{
  "stage": "8b",
  "layer": "events (within-tenure timing)",
  "vintage": "2026-10-17",
  "generated_at": "2026-10-18T10:37:13+0100",
  "generator": "analysis/R/06_events.R",
  "spec": "analysis/specs/events.yml",
  "verifier": "tests/verify_events.py",
  "input": {
    "database": "data/analytics.duckdb",
    "national_conflict_table": "main_analytics.ucdp_national_monthly",
    "oil_metric_id": "oil",
    "fact_metric_table": "main_analytics.fact_metric",
    "administration_term_table": "main_analytics.dim_administration_term"
  },
  "series": {
    "start_month": "1999-01",
    "end_month": "2024-12",
    "outcomes": ["fatalities", "incidents"],
    "n_months": 312,
    "months_filled_with_zero": 25,
    "filled_by_year": [
      {
        "year": 1999,
        "months": 2
      },
      {
        "year": 2000,
        "months": 4
      },
      {
        "year": 2001,
        "months": 3
      },
      {
        "year": 2002,
        "months": 2
      },
      {
        "year": 2003,
        "months": 1
      },
      {
        "year": 2004,
        "months": 1
      },
      {
        "year": 2005,
        "months": 3
      },
      {
        "year": 2006,
        "months": 5
      },
      {
        "year": 2008,
        "months": 1
      },
      {
        "year": 2009,
        "months": 3
      }
    ],
    "blank_months_rule": "An absent month is filled with **zero** for the 1999-01 -> 2024-12 window and the count of filled months is published on the artifact. The rule is declared rather than assumed because it is the only discretionary step in the series: UCDP emits no row when no event was recorded, and dropping those months instead would silently turn \"no reported event\" into \"not in the sample\" — which is the difference between a mean and a conditional mean."
  },
  "windows": {
    "pre_months": 96,
    "focus_horizons": [12, 24],
    "min_post_fraction": 0.75,
    "min_post_months_by_horizon": {
      "12": 9,
      "24": 18
    },
    "min_post_rule": "A truncated post-window is kept only when it still covers **75 % of the requested horizon** — 9 of 12 months, 18 of 24. The floor is a fraction rather than a month count because the two horizons are of different lengths: a rule stated in months would either admit four months as an \"h = 24\" estimate or reject a 20-month window out of 24. Every kept row carries `truncated_by_next_transition`; a window below the floor is published as `not_estimated` with its reason and the number of months it had, and is never fitted.",
    "post_end_rule": "A post-window is truncated at the next transition, so an event is never compared against months that belong to its successor. With four transitions 36 to 96 months apart, the truncated windows are the honest ones: sharing months between two events would double-count the same violence.",
    "skips": []
  },
  "events": [
    {
      "id": "yaradua_2007",
      "date": "2007-05-29",
      "label": "Yar'Adua sworn in",
      "tenure_stratum": "PDP_first",
      "term_id": 21,
      "note": null,
      "transition_month": "2007-05",
      "pre_months_available": 100,
      "post_window_end": "2010-04",
      "truncated_by_next_transition": false,
      "place_in_series": {
        "from": "1999-01",
        "to": "2024-12"
      }
    },
    {
      "id": "jonathan_2010",
      "date": "2010-05-06",
      "label": "Jonathan sworn in",
      "tenure_stratum": "PDP_first",
      "term_id": 31,
      "note": "Acting from 2010-02-09; the sworn-in date is the single decided boundary (`dim_administration`, S3-04) and is not re-litigated here.",
      "transition_month": "2010-05",
      "pre_months_available": 136,
      "post_window_end": "2015-04",
      "truncated_by_next_transition": false,
      "place_in_series": {
        "from": "1999-01",
        "to": "2024-12"
      }
    },
    {
      "id": "buhari_2015",
      "date": "2015-05-29",
      "label": "Buhari sworn in",
      "tenure_stratum": "APC_first",
      "term_id": 41,
      "note": null,
      "transition_month": "2015-05",
      "pre_months_available": 196,
      "post_window_end": "2023-04",
      "truncated_by_next_transition": false,
      "place_in_series": {
        "from": "1999-01",
        "to": "2024-12"
      }
    },
    {
      "id": "tinubu_2023",
      "date": "2023-05-29",
      "label": "Tinubu sworn in",
      "tenure_stratum": "APC_first",
      "term_id": 51,
      "note": "The post-window is truncated by the end of the UCDP archive (2024-12): 19 months, below the 24-month focus horizon, so this event is reported at h=12 only and that is stated rather than silently dropped.",
      "transition_month": "2023-05",
      "pre_months_available": 292,
      "post_window_end": "2024-12",
      "truncated_by_next_transition": true,
      "place_in_series": {
        "from": "1999-01",
        "to": "2024-12"
      }
    }
  ],
  "excluded": [
    {
      "id": "obasanjo_1999",
      "date": "1999-05-29",
      "why": "No pre-period. The conflict series begins 1999-01, four months before the transition, and the design needs 96 pre-months. This is the reason the earliest tenure cannot be compared on monthly conflict at all — not a modelling choice but where the data starts."
    }
  ],
  "placebo": {
    "rule": "Every eligible month in the series is tried as if it were a transition, with the same windows, statistic and controls. The p-value is the **tail in the direction of the estimate** — for an increase, the share of placebo statistics at least as large; for a decline, the share at most as small — and it is reported per event and for the largest of the four real events, the latter because a reader looking at four estimates is looking at the largest of them whether or not the artifact says so. The p-value is the add-one randomisation form, `(1 + #{tail}) / (n + 1)`, so it is never zero: with 58 placebo months the smallest attainable value is 1/59 = 0.017, and the artifact may not claim more resolution than that.",
    "direction": "same_side_tail",
    "direction_why": "Declared as the same-side tail rather than one-sided on increase, because the headline case people ask about — the 2015 transition — is a **fall** in reported violence, and an increase-only rule would report every decline as \"no shift\" by construction. It is also not tested in absolute magnitude: the placebo null is not centred on zero (reported fatalities drift down through the window, so the placebo distribution sits near a 32 % decline), and a magnitude test against an off-centre null would score a large fall as \"easily matched\" while its own left tail says the opposite. The signed tail uses the empirical null as it actually is.",
    "p_definition": "(1 + #{placebo at least as extreme as the observed shift, on the side the shift points at}) / (n + 1)",
    "eligible_months_rule": "A month is eligible when it has `pre_months` before it and enough months after it inside the series to satisfy `min_post_fraction` at the **longest** declared horizon (18 months), and it lies more than `buffer_months` from any real transition. Requiring the strictest horizon of every placebo month keeps the placebo distribution identical across horizons, so a p-value at h = 12 and one at h = 24 are drawn from the same set. The exclusion buffer is declared so that a placebo cannot be a real transition wearing a different hat.",
    "exclusion_buffer_months": 24,
    "eligible_months": 58,
    "first_eligible": "2012-06",
    "last_eligible": "2021-04",
    "deterministic": true,
    "distributions": [
      {
        "outcome": "fatalities",
        "horizon": 12,
        "n": 58,
        "mean_beta": -0.38954585317,
        "sd_beta": 0.47495577559,
        "quantiles": [
          -1.0078273795,
          -0.39897017647,
          0.25319497999,
          0.29035626356,
          0.4257042789
        ],
        "abs_quantiles": [
          0.42703474023,
          0.95162313103,
          1.0078273795,
          1.017989107
        ]
      },
      {
        "outcome": "fatalities",
        "horizon": 24,
        "n": 58,
        "mean_beta": -0.36077920058,
        "sd_beta": 0.56155292079,
        "quantiles": [
          -1.1795047974,
          -0.2595909472,
          0.3160978752,
          0.39789107624,
          0.5661672598
        ],
        "abs_quantiles": [
          0.4124001515,
          1.1535508235,
          1.1795047974,
          1.1964339754
        ]
      },
      {
        "outcome": "incidents",
        "horizon": 12,
        "n": 58,
        "mean_beta": -0.20438076841,
        "sd_beta": 0.23886985699,
        "quantiles": [
          -0.69148024797,
          -0.18553685104,
          0.10176254633,
          0.16271753445,
          0.17199224611
        ],
        "abs_quantiles": [
          0.18553685104,
          0.60974528437,
          0.69148024797,
          0.71958092368
        ]
      },
      {
        "outcome": "incidents",
        "horizon": 24,
        "n": 58,
        "mean_beta": -0.25148786782,
        "sd_beta": 0.22635490001,
        "quantiles": [
          -0.71039236591,
          -0.23042589999,
          -0.0074886764451,
          -0.00040693332074,
          0.0097510596577
        ],
        "abs_quantiles": [
          0.23042589999,
          0.62406692417,
          0.71039236591,
          0.75196114561
        ]
      }
    ],
    "family_wise": [
      {
        "outcome": "fatalities",
        "horizon": 12,
        "largest_event": "buhari_2015",
        "largest_beta": -1.1229444483,
        "largest_proportional": -0.67467950637,
        "p": 0.016949152542,
        "n_placebo": 58,
        "direction": "decrease"
      },
      {
        "outcome": "fatalities",
        "horizon": 24,
        "largest_event": "buhari_2015",
        "largest_beta": -1.5968879158,
        "largest_proportional": -0.79747418433,
        "p": 0.016949152542,
        "n_placebo": 58,
        "direction": "decrease"
      },